{
  "$schema": "https://json-schema.org/draft/2020-12/schema",
  "$id": "palavox/authoring-schema/v0.1/lesson",
  "title": "Palavox lesson authoring file (schema v0.1)",
  "description": "One JSON file per lesson. Implements the lesson/exercise/vocab subset of the unified content-authoring schema v0.1 (docs/palavox-overhaul-plan/wip-07-08-consistency-report.md section 2), restricted to what the current DB schema (migration 20260729164446) can hold. Fields the DB cannot hold yet are either mapped by the seed generator (translations.es -> vocabulary.translation_l1) or carried as authoring-only metadata. Per-type structural rules (exactly one correct option, tokens for ordering, pairs for matching) are enforced by the deterministic validator gate G-keys, not by JSON Schema conditionals.",
  "type": "object",
  "additionalProperties": false,
  "required": [
    "id",
    "title",
    "skill_type",
    "position",
    "objective",
    "est_minutes",
    "intro_md",
    "exercises",
    "vocabulary_refs",
    "new_vocabulary"
  ],
  "properties": {
    "id": {
      "type": "string",
      "pattern": "^EN-U[0-9]{2}-L[0-9]{2}$",
      "description": "Lesson natural key, e.g. EN-U01-L05. Drives deterministic seed UUIDs."
    },
    "title": { "type": "string", "minLength": 3, "maxLength": 120 },
    "skill_type": {
      "enum": ["vocab", "grammar", "reading", "listening", "speaking", "writing"],
      "description": "Must match public.skills.type CHECK constraint. The seed generator creates one skill row per skill_type used in the unit and attaches the lesson to it."
    },
    "position": {
      "type": "integer",
      "minimum": 1,
      "description": "1-based order within the unit; must match the lesson's index in the unit manifest lesson list."
    },
    "objective": {
      "type": "string",
      "minLength": 10,
      "maxLength": 240,
      "description": "One-line learner-facing objective (band-file 'obj')."
    },
    "est_minutes": {
      "type": "integer",
      "minimum": 1,
      "maximum": 30,
      "description": "Estimated core minutes. Band target is 8-18 (schema v0.1 lesson.est_minutes); the validator warns outside that range."
    },
    "intro_md": {
      "type": "string",
      "minLength": 1,
      "maxLength": 1200,
      "description": "Markdown intro rendered in the learner's L1. May contain {{l1_contrast:<target_id>}} slots. Maps to public.lessons.intro_md."
    },
    "status": {
      "enum": ["draft"],
      "description": "Authoring files are always draft in Phase 0. Promotion beyond draft happens only through the full gauntlet plus owner approval, never in the authoring file."
    },
    "prerequisites": {
      "type": "array",
      "items": { "type": "string", "pattern": "^EN-U[0-9]{2}-L[0-9]{2}$" },
      "description": "Authoring-only metadata for the future lesson_prereqs table (schema v0.1); not seeded today."
    },
    "can_do_refs": {
      "type": "array",
      "items": { "type": "string", "minLength": 3 },
      "description": "Authoring-only pointers into can_do_statements; seeding the map is deferred until statements are seeded."
    },
    "grammar_refs": {
      "type": "array",
      "items": { "type": "string", "minLength": 2 },
      "description": "Dotted grammar keys (e.g. gram.be.wh_questions). Authoring-only until grammar_points lands (plan 13 extension)."
    },
    "pron_refs": {
      "type": "array",
      "items": { "type": "string", "minLength": 2 },
      "description": "Dotted pron target keys. Authoring-only until pron_targets lands."
    },
    "notes": { "type": "string", "maxLength": 2000 },
    "vocabulary_refs": {
      "type": "array",
      "items": { "type": "string", "minLength": 1, "maxLength": 80 },
      "description": "Lemma keys of previously taught vocabulary this lesson recycles. Each must resolve to a new_vocabulary lemma of an earlier lesson in the unit (validator warns on unresolved refs; unresolved refs do NOT extend the allowed-lemma set)."
    },
    "new_vocabulary": {
      "type": "array",
      "items": { "$ref": "#/$defs/vocab_item" },
      "description": "Vocabulary items or chunks introduced by this lesson. These (plus prior lessons') define the G-vocab-boundary allowed set."
    },
    "exercises": {
      "type": "array",
      "minItems": 1,
      "items": { "$ref": "#/$defs/exercise" },
      "description": "Ordered exercise sequence. G-counts enforces 6-14 per lesson (Phase 0 slice rule); schema keeps minItems 1 so partial drafts can still be schema-checked while failing G-counts honestly."
    }
  },
  "$defs": {
    "exercise": {
      "type": "object",
      "additionalProperties": false,
      "required": ["type", "prompt", "difficulty", "receptive_productive"],
      "properties": {
        "seq": { "type": "integer", "minimum": 1, "description": "Optional explicit sequence number; must equal 1-based array index when present." },
        "type": {
          "enum": ["flashcard", "cloze", "matching", "ordering", "dictation", "listening_mc", "speaking", "translation", "dialogue"],
          "description": "Exactly the public.exercises.type CHECK list."
        },
        "prompt": {
          "type": "string",
          "minLength": 1,
          "maxLength": 600,
          "description": "Learner-visible prompt. Conventions: [L1: ...] segments render in the learner's L1; [audio, 0.75x] marks an audio play instruction. Bracketed segments are excluded from G-vocab-boundary scanning."
        },
        "difficulty": {
          "type": "number",
          "minimum": 0,
          "maximum": 1,
          "description": "0-1 as stored in public.exercises.difficulty. G-difficulty requires first exercise <= last (warm-up ramp)."
        },
        "receptive_productive": {
          "enum": ["receptive", "productive", "receptive_to_productive"],
          "description": "receptive_to_productive (FSRS card-flip semantics, band file 13a) is authoring-level; the DB CHECK only allows receptive|productive, so the seed generator maps it to 'productive' with a TODO comment."
        },
        "timing_s": { "type": "integer", "minimum": 5, "maximum": 600 },
        "rationale": {
          "type": "string",
          "minLength": 10,
          "maxLength": 500,
          "description": "Author-facing pedagogical rationale for the exercise as a whole (why it exists here). Required by G-keys for every exercise: filler items with no articulable purpose must not pass."
        },
        "options": {
          "type": "array",
          "minItems": 2,
          "maxItems": 6,
          "items": { "$ref": "#/$defs/option" },
          "description": "Choice options (maps to public.exercise_options). Required for listening_mc. G-keys: exactly one is_correct=true, and that option must carry a rationale."
        },
        "tokens": {
          "type": "array",
          "minItems": 2,
          "items": { "type": "string", "minLength": 1 },
          "description": "Scrambled tokens for ordering exercises (required for type=ordering; G-keys)."
        },
        "key": { "type": "string", "minLength": 1, "maxLength": 300, "description": "Single expected answer (ordering/dictation)." },
        "keys": {
          "type": "array",
          "minItems": 1,
          "items": { "type": "string", "minLength": 1 },
          "description": "Expected answers in blank order (cloze)."
        },
        "pairs": {
          "type": "array",
          "minItems": 2,
          "maxItems": 6,
          "items": {
            "type": "object",
            "additionalProperties": false,
            "required": ["left", "right"],
            "properties": {
              "left": { "type": "string", "minLength": 1 },
              "right": { "type": "string", "minLength": 1 }
            }
          },
          "description": "Matching pairs (required for type=matching; G-keys)."
        },
        "distractor_bank": {
          "type": "array",
          "items": { "type": "string", "minLength": 1 },
          "description": "Learner-visible wrong choices for cloze blanks; scanned by G-vocab-boundary."
        },
        "expected_pattern": {
          "type": "string",
          "maxLength": 300,
          "description": "Speaking target pattern; {slot} placeholders are excluded from G-vocab-boundary scanning."
        },
        "asr_focus": {
          "type": "array",
          "items": { "type": "string" },
          "description": "Author-facing ASR checks (not learner input; not vocab-scanned)."
        },
        "scoring": { "type": "string", "maxLength": 400 },
        "ai_interaction_ref": {
          "type": "string",
          "maxLength": 80,
          "description": "Reference to a (future) ai_interaction_specs contract for dialogue exercises. Authoring-only in Phase 0."
        }
      }
    },
    "option": {
      "type": "object",
      "additionalProperties": false,
      "required": ["label", "is_correct"],
      "properties": {
        "label": { "type": "string", "minLength": 1, "maxLength": 200 },
        "is_correct": { "type": "boolean" },
        "rationale": {
          "type": "string",
          "minLength": 5,
          "maxLength": 400,
          "description": "Why this option is right/wrong. REQUIRED on the correct option (G-keys hard fail); strongly recommended on distractors (G-keys warning)."
        }
      }
    },
    "vocab_item": {
      "type": "object",
      "additionalProperties": false,
      "required": ["lemma", "pos", "cefr_level", "example_sentence", "translations"],
      "properties": {
        "lemma": {
          "type": "string",
          "minLength": 1,
          "maxLength": 80,
          "description": "Word or multiword chunk (chunks allowed, e.g. \"Where are you from?\"). Natural key for the vocabulary row (lowercased)."
        },
        "pos": {
          "enum": ["noun", "verb", "adjective", "adverb", "pronoun", "preposition", "conjunction", "determiner", "interjection", "number", "chunk"],
          "description": "Part of speech; 'chunk' for formulaic multiword items. Maps to vocabulary.part_of_speech."
        },
        "cefr_level": { "enum": ["A1", "A2", "B1", "B2", "C1", "C2"] },
        "example_sentence": { "type": "string", "minLength": 5, "maxLength": 240 },
        "ipa": { "type": "string", "maxLength": 120 },
        "frequency_rank": { "type": "integer", "minimum": 1 },
        "translations": {
          "type": "object",
          "required": ["es"],
          "additionalProperties": { "type": "string", "minLength": 1, "maxLength": 200 },
          "description": "Keyed by BCP-47-ish L1 code. 'es' is REQUIRED for this slice; other L1s optional. The DB has only vocabulary.translation_l1 today: the seed generator writes translations.es there and emits a TODO for the vocabulary_translations extension (plan 13)."
        }
      }
    }
  }
}
